[
  {
    "schema_version": 1,
    "id": "demand-demo-001",
    "pilot_id": "pilot-demo",
    "status": "funded",
    "consent_version": "pilot-consent-v1",
    "client_org_id": "client-demo-001",
    "decision_authority_confirmed": true,
    "funding_commitment": true,
    "funding_evidence_ref": "external://funding-demo-001",
    "problem": {"background": "小型公益组织每周手工整理报名数据", "domain": "nonprofit", "target_users": ["项目协调员"], "desired_outcome": "报名数据能被稳定清洗并生成可复核周报"},
    "scope": {"deliverables": ["数据清洗脚本", "周报生成流程", "操作说明", "验收测试"], "out_of_scope": ["替换现有报名系统", "处理真实身份信息"]},
    "acceptance": {"criteria": ["20 份匿名样例均生成正确周报", "错误输入有明确提示", "协调员可按说明独立运行"], "owner": "role-project-lead", "response_days": 3},
    "skills": {"must_have": ["python", "automation"], "nice_to_have": ["requirements-analysis", "quality-assurance"], "level": "advanced"},
    "matching": {"problem_types": ["workflow-automation"], "domains": ["nonprofit", "small-business"], "tasks": ["python-development", "automation", "testing"]},
    "schedule": {"start_date": "2026-08-18", "due_date": "2026-09-12", "estimated_days": 10, "weekly_hours": 18, "duration_weeks": 4},
    "budget": {"minimum": 18000, "maximum": 26000, "currency": "CNY", "direct_cost": 500},
    "payment": {"plan": [{"milestone": "可运行原型", "percent": 40}, {"milestone": "验收与移交", "percent": 60}]},
    "risk": {"uncertainty": "medium", "urgency": "low", "external_dependencies": "medium", "data_sensitivity": "low", "data_handling_plan": "只使用去标识化样例；真实数据保留在需求方设备"},
    "ai": {"allowed": true, "required": false, "data_model_policy": "匿名样例可发送；真实数据不得发送"},
    "collaboration": {"languages": ["zh-CN"], "preferred_work_mode": "async-first", "feedback_frequency": "twice-weekly", "team_preference": "solo"},
    "location": {"region": "CN", "allowed_creator_regions": ["CN", "JP"]}
  },
  {
    "schema_version": 1,
    "id": "demand-demo-002",
    "pilot_id": "pilot-demo",
    "status": "funded",
    "consent_version": "pilot-consent-v1",
    "client_org_id": "client-demo-002",
    "decision_authority_confirmed": true,
    "funding_commitment": true,
    "funding_evidence_ref": "external://funding-demo-002",
    "problem": {"background": "教育团队需要验证一个课程资料检索原型", "domain": "education", "target_users": ["课程设计师"], "desired_outcome": "用户能在十分钟内找到并保存匹配的课程资料"},
    "scope": {"deliverables": ["交互原型", "5 人可用性测试记录", "关键问题与下一步建议"], "out_of_scope": ["正式账号系统", "生产部署", "收集学生个人数据"]},
    "acceptance": {"criteria": ["覆盖三个约定检索任务", "完成 5 次测试", "问题按严重度归类"], "owner": "role-product-owner", "response_days": 3},
    "skills": {"must_have": ["ux-design", "web-frontend"], "nice_to_have": ["user-research"], "level": "standard"},
    "matching": {"problem_types": ["prototype-validation"], "domains": ["education"], "tasks": ["ux-design", "web-development", "discovery"]},
    "schedule": {"start_date": "2026-08-24", "due_date": "2026-09-18", "estimated_days": 8, "weekly_hours": 16, "duration_weeks": 4},
    "budget": {"minimum": 12000, "maximum": 18000, "currency": "CNY", "direct_cost": 1000},
    "payment": {"plan": [{"milestone": "原型与测试计划", "percent": 50}, {"milestone": "测试报告", "percent": 50}]},
    "risk": {"uncertainty": "medium", "urgency": "medium", "external_dependencies": "low", "data_sensitivity": "low", "data_handling_plan": "仅使用公开课程资料和虚构用户"},
    "ai": {"allowed": false, "required": false, "data_model_policy": "本项目交付物不使用生成式 AI"},
    "collaboration": {"languages": ["zh-CN"], "preferred_work_mode": "async-first", "feedback_frequency": "twice-weekly", "team_preference": "solo"},
    "location": {"region": "CN", "allowed_creator_regions": ["CN"]}
  },
  {
    "schema_version": 1,
    "id": "demand-demo-003",
    "pilot_id": "pilot-demo",
    "status": "funded",
    "consent_version": "pilot-consent-v1",
    "client_org_id": "client-demo-003",
    "decision_authority_confirmed": true,
    "funding_commitment": true,
    "funding_evidence_ref": "external://funding-demo-003",
    "problem": {"background": "研究团队有一批公开资料，需要形成可追溯的主题综述", "domain": "research", "target_users": ["研究负责人", "项目成员"], "desired_outcome": "形成带来源映射、可继续维护的主题综述"},
    "scope": {"deliverables": ["资料分类表", "主题综述", "来源到结论的映射", "维护说明"], "out_of_scope": ["访问付费数据库", "代写学术论文", "处理未公开访谈资料"]},
    "acceptance": {"criteria": ["所有结论可追溯到提供来源", "覆盖约定的四个主题", "随机抽查无虚构引用"], "owner": "role-research-lead", "response_days": 4},
    "skills": {"must_have": ["data-analysis", "technical-writing"], "nice_to_have": ["information-architecture"], "level": "advanced"},
    "matching": {"problem_types": ["research-synthesis", "data-organization"], "domains": ["research"], "tasks": ["research", "data-analysis", "writing"]},
    "schedule": {"start_date": "2026-08-20", "due_date": "2026-09-25", "estimated_days": 12, "weekly_hours": 15, "duration_weeks": 5},
    "budget": {"minimum": 26000, "maximum": 36000, "currency": "CNY", "direct_cost": 800},
    "payment": {"plan": [{"milestone": "分类框架与样章", "percent": 35}, {"milestone": "完整综述", "percent": 45}, {"milestone": "核验与移交", "percent": 20}]},
    "risk": {"uncertainty": "medium", "urgency": "low", "external_dependencies": "medium", "data_sensitivity": "public", "data_handling_plan": "全部来源公开；保存来源 URL 与访问日期"},
    "ai": {"allowed": true, "required": false, "data_model_policy": "公开资料可辅助整理；每项结论人工逐源核验"},
    "collaboration": {"languages": ["zh-CN", "en"], "preferred_work_mode": "async-first", "feedback_frequency": "weekly", "team_preference": "solo"},
    "location": {"region": "CN", "allowed_creator_regions": ["CN", "JP"]}
  }
]
